id,translation
1055,"{'de': 'Das weiße Kaninchen setzte seine Brille auf. »Wo befehlen Eure Majestät, daß ich anfangen soll?« fragte es.', 'eo': 'La Blanka Kuniklo almetis siajn okulvitrojn. ""Kie vi volas ke mi komencu?"" li demandis.'}"
1056,"{'de': ""»Fange beim Anfang an,« sagte der König ernsthaft, »und lies bis du an's Ende kommst, dann halte an.«"", 'eo': '""Komencu ĉe la komenco,"" diris la Reĝo solene, ""kaj daŭrigu ĝis vi venos al la fino; kaj ĉe la fino ĉesu legi.""'}"
1057,"{'de': 'Dies waren die Verse, welche das weiße Kaninchen vorlas:', 'eo': 'Jen la versaĵoj kiujn la Blanka Kuniklo legis:'}"
1058,"{'de': ""»Ich höre ja du warst bei ihr, Und daß er mir es gönnt; Sie sprach, sie hielte viel von mir, Wenn ich nur schwimmen könnt'! Wenn ich nur schwimmen könnt'!"", 'eo': 'Li diris ke vi vidis ŝin Kaj nomis min ĉe li, ho! Ŝi laŭdis min (atentu ĝin) Sed ne pri la talio.'}"
1059,"{'de': 'Er schrieb an sie, ich ginge nicht (Nur wußten wir es gleich): Wenn ihr viel an der Sache liegt, Was würde dann aus euch ?', 'eo': 'Anoncis li ke restos mi Ĉi tie—ni ĝin sciis. ""Se la aferon puŝos ŝi, Ho ve al mi,"" vi kriis.'}"
1060,"{'de': 'Ich gab ihr eins, sie gab ihm zwei, Ihr gabt uns drei Mal vier; Jetzt sind sie hier, er steht dabei; Doch alle gehörten erst mir.', 'eo': 'Al ŝi nur unu, du al li, Tri, kvar al ni li donis! Sed ĉiuj venis re al vi Li tion ne oponis.'}"
1061,"{'de': ""Würd' ich und sie vielleicht darein Verwickelt und verfahren, Vertraut er dir, sie zu befrei'n Gerade wie wir waren."", 'eo': 'Se mi aŭ ŝi en tio ĉi Kulpiĝus, li tre fida Ke igos nin liberaj vi Kiel nin vi nun vidas.'}"
1062,"{'de': ""Ich dachte schon in meinem Sinn, Eh' sie den Anfall hätt', Ihr wär't derjenige, der ihn, Es und uns hindertet."", 'eo': ""Supozis mi ke estis vi Malhelpo al la planoj (Dolor' vi for! ekkriis ŝi) De ni kaj ĝi—pri ranoj. Ne sciu li pri ŝia ŝat';""}"
1063,"{'de': ""Sag' ihm um keinen Preis, daß ihr Die Andern lieber war'n; Denn keine Seele außer dir Und mir darf dies erfahr'n.«"", 'eo': ""Ĉar tiu devas esti Sekreta—kiel diplomat'! Ĉu vi ne volas resti?""}"
1064,"{'de': '»Das ist das wichtigste Beweisstück, das wir bis jetzt gehört haben,« sagte der König, indem er sich die Hände rieb; »laßt also die Geschwornen -«', 'eo': '""Jen la plej grava evidencaĵo kiun ni ĝis nun aŭskultis,"" diris kontente la Reĝo, kaj frotis al si la manojn. ""Nun do la ĵurintoj konsid...""'}"
1065,"{'de': '»Wenn es Einer von ihnen erklären kann,« sagte Alice (sie war die letzten Paar Minuten so sehr gewachsen, daß sie sich gar nicht fürchtete, ihn zu unterbrechen), »so will ich ihm sechs Dreier schenken. Ich finde, daß auch keine Spur von Sinn darin ist.«', 'eo': '""Se iu el ili povos klarigi ĝin,"" diris Alicio—ŝi en la lastaj minutoj tiom grandiĝis ke ŝi jam ne timis interrompi eĉ la Reĝon mem—""mi donacos al li ses pencojn (250sd.); mi mem kredas ke enestas en ĝi eĉ ne unu ero da racia signifo.""'}"
1066,"{'de': 'Die Geschwornen schrieben Alle auf ihre Tafeln: »Sie findet, daß auch keine Spur von Sinn darin ist;« aber keiner versuchte, das Schriftstück zu erklären.', 'eo': 'Ĉiuj ĵurintoj elskribis sur la ardezoj ke ""Ŝi kredas ke enestas eĉ ne unu ero da signifo,"" sed neniu el ili, malgraŭ la oferita premio, penis klarigi la versojn.'}"
1067,"{'de': '»Wenn kein Sinn darin ist,« sagte der König, »das spart uns ja ungeheuer viel Arbeit; dann haben wir nicht nöthig, ihn zu suchen.', 'eo': '""Se enestas nenia signifo,"" diris la Reĝo, ""tio ja ŝparos al ni multe da ĝeno, ĉar signifojn ni ne bezonas serĉi.'}"
1068,"{'de': ""Und dennoch weiß ich nicht,« fuhr er fort, indem er das Papier auf dem Knie ausbreitete und es prüfend beäugelte, »es kommt mir vor, als könnte ich etwas Sinn darin finden. ›wenn ich nur schwimmen könnt'!‹ du kannst nicht schwimmen, nicht wahr?« wandte er sich an den Buben."", 'eo': 'Tamen, mi ne estas certa,"" li daŭrigis, etendante la versojn sur la genuo kaj kritike per unu okulo rigardante ilin; ""Mi malgraŭ ĉio komencas trovi en ili ian signifon. \'Sed ne pri la talio.\''}"
1069,"{'de': ""»Das trifft zu, so weit,« sagte der König und fuhr fort, die Verse leise durchzulesen. »›Nur wußten wir es gleich‹ - das sind die Geschwornen, natürlich ›Ich gab ihr eins, sie gab ihm zwei -‹ ja wohl, so hat er's mit den Kuchen gemacht, versteht sich -«"", 'eo': '""\'Ni ĝin sciis\' tio kompreneble aludas la ĵurintojn. \'Al ŝi nur unu, du al li, Tri, kvar al ni li donis\' jen kion li faris disdonacante la tortojn.""'}"
1070,"{'de': '»Aber es geht weiter: ›Jetzt sind sie hier,‹« sagte Alice', 'eo': '""Sed,"" kontraŭdiris Alicio, ""la daŭrigo montras ke \'ĉiuj venis re al vi.\'""'}"
1071,"{'de': '»Freilich, da sind sie ja! er steht doch dabei!« sagte der König triumphirend und wies dabei nach den Kuchen auf dem Tische und nach dem Buben; »nichts kann klarer sein.', 'eo': '""Kaj jen ili,"" triumfis la Reĝo, montrante sur la tablon. ""Nenio povas esti pli klara pruvo ol tio.'}"
1072,"{'de': ""Dann wieder ›Eh sie den Anfall hätt'‹ du hast nie einen Anfall gehabt, Liebe, glaube ich,« sagte er zu der Königin."", 'eo': ""Ankaŭ tion ĉi atentu: 'Dolor' vi for, ekkriis ŝi.' Ĉu vi, mia kara, (turnante sin al la Damo) ne ordonis ke la Loro estu for?""}"
1073,"{'de': '»Niemals,« rief die Königin wütend und warf dabei der Eidechse ein Tintenfaß an den Kopf.', 'eo': '""Certege,"" kriis la Damo, kaj furioze ĵetis kontraŭ la Loron grandan inkujon. La inkujo trafis—ne la Loron—sed Bil Lacerton.'}"
1074,"{'de': '(Der unglückliche kleine Wabbel hatte aufgehört, mit dem Finger auf seiner Tafel zu schreiben, da er merkte, daß es keine Spuren hinterließ; doch nun fing er eilig wieder an, indem er die Tinte benutzte, die von seinem Gesichte herab träufelte, so lange, dies vorhielt.)', 'eo': 'Tiu jam de longe ĉesis skribi per la fingro, ĉar li ne sukcesis fari per ĝi markojn; sed nun la kompatinda besteto laboreme rekomencis la fingroskribon, uzante la inkon, kiu gutfalis de lia vizaĝo. La Loro tute ne atentis la inkujon; li nur ĝentile klinis sin antaŭ la trono kaj majeste marŝis for.'}"
1075,"{'de': '»Dann ist dies nicht dein Fall,« sagte der König und blickte lächelnd in dem ganzen Saale herum.', 'eo': '""Doloro for! Do, Loro, for!"" la Reĝo ripetis per speciale atentiga voĉo, kaj ĉirkaŭrigardis la ĉeestantaron kun afabla rideto.'}"
1076,"{'de': 'Alles blieb totenstill.', 'eo': 'Sekvis tre embarasa silento.'}"
1077,"{'de': ""»'s ist ja 'n Witz!« fügte der König in ärgerlichem Tone hinzu sogleich lachte Jedermann. »Die Geschwornen sollen ihren Ausspruch tun,« sagte der König wohl zum zwanzigsten Male."", 'eo': 'Fine la Reĝo devis anonci ""Mi faris ŝercon,"" kaj—tuj la korteganoj aplaŭdis amase. ""La ĵurintoj konsideru la verdikton,"" diris la Reĝo, jam la dudekan fojon!'}"
1078,"{'de': '»Nein, nein!« sagte die Königin. »Erst das Urteil, der Ausspruch der Geschwornen nachher.«', 'eo': 'Ĉi tiun fojon la Damo interrompis. ""Ne, ne,"" ŝi diris, ""ni havu unue la juĝon, kaj nur poste la verdikton.""'}"
1079,"{'de': '»Dummer Unsinn!« sagte Alice laut. »Was für ein Einfall, erst das Urteil haben zu wollen!«', 'eo': '""Vi parolas sensencaĵon,"" laŭte diris Alicio.'}"
1080,"{'de': '»Halt den Mund!« sagte die Königin, indem sie purpurrot wurde.', 'eo': '""Senkapigu ŝin,"" kriegis la Damo per ŝia plej alta voĉtono. Tamen neniu ekmovis sin!'}"
1081,"{'de': 'Niemand rührte sich. »Wer fragt nach euch?« sagte Alice (unterdessen hatte sie ihre volle Größe erreicht). »Ihr seid nichts weiter als ein Spiel Karten !«', 'eo': '""Mi ne timas vin"" diris Alicio (ŝi jam kreskis ĝis sia normala alteco). ""Vi ja estas nenio,—nenio krom ludkartaro!""'}"
1082,"{'de': ""Bei diesen Worten erhob sich das ganze Spiel in die Luft und flog auf sie herab; sie schrie auf, halb vor Furcht, halb vor Ärger, versuchte sie sich abzuwehren und merkte, daß sie am Ufer lag, den Kopf auf dem Schoße ihrer Schwester, welche leise einige welke Blätter fortnahm, die ihr von den Bäumen herunter auf's Gesicht gefallen waren."", 'eo': 'Ŝi eligis krieton, krieton duone timan kaj duone koleran, penis forfrapi ilin kaj— —trovis sin kuŝanta sur la deklivo. Jen la fratino vartis ŝian kapon sur la genuoj kaj forbrosas kelke da sekaj folioj falintaj de la arboj sur ŝian vizaĝon.'}"
1083,"{'de': '»Wach auf, liebe Alice!« sagte ihre Schwester; »du hast mal lange geschlafen!« »O, und ich habe einen so merkwürdigen Traum gehabt!« sagte Alice, und sie erzählte ihrer Schwester, so gut sie sich erinnern konnte, alle die seltsamen Abenteuer, welche ihr eben gelesen habt.', 'eo': '""Ho, mi estas sonĝinta tian kuriozan sonĝon,"" diris Alicio. Kaj ŝi rakontis al la fratino laŭeble ĉiujn ĉi strangajn Aventurojn, kiujn vi ĵus tralegis.'}"
1084,"{'de': 'Als sie fertig war, gab ihre Schwester ihr einen Kuß und sagte:', 'eo': 'Kiam ŝi finis la rakonton, la fratino kisis ŝin, dirante:—'}"
1085,"{'de': '»Es war ein sonderbarer Traum, das ist gewiß; aber nun lauf hinein zum Thee, es wird spät.« Da stand Alice auf und rannte fort, und dachte dabei, und zwar mit Recht, daß es doch ein wunderschöner Traum gewesen sei.', 'eo': 'Sed jam malfruiĝas; vi do kuru en la domon por la temanĝo."" Alicio tuj levis sin kaj rajte pensis—dum ŝi kuras—kian mirindan sonĝon ŝi sonĝis!'}"
1086,"{'de': 'Aber ihre Schwester blieb sitzen, wie sie sie verlassen hatte, den Kopf auf die Hand gestützt, blickte in die untergehende Sonne und dachte an die kleine Alice und ihre wunderbaren Abenteuer, bis auch sie auf ihre Weise zu träumen anfing, und dies war ihr Traum:', 'eo': 'Sed la fratino ankoraŭ sidis sur la deklivo, apogante la kapon per la mano, kaj rigardante la sunsubiron. Ŝi komencis pripensi la fratineton kaj ĉiujn ŝiajn aventurojn, ĝis ankaŭ ŝi falis en revon.'}"
1087,"{'de': 'Zuerst träumte sie von der kleinen Alice selbst: wieder sah sie die kleinen Händchen zusammengefaltet auf ihrem Knie, und die klaren sprechenden Augen, die zu ihr aufblickten – sie konnte selbst den Ton ihrer Stimme hören und das komische Zurückwerfen des kleinen Köpfchens sehen, womit sie die einzelnen Haare abschüttelte, die ihr immer wieder in die Augen kamen – und je mehr sie zuhörte oder zuzuhören meinte, desto mehr belebte sich der ganze Platz um sie herum mit den seltsamen Geschöpfen aus ihrer kleinen Schwester Traum.', 'eo': 'En ŝia fantazio denove la manetoj de Alicio kunligiĝis sur ŝiaj genuoj, denove tiuj klarbluaj okuloj de Alicio rigardas supren en ŝiajn. Ŝi kvazaŭ aŭdis la verajn voĉtonojn, kvazaŭ vidis tiun nur-Alician kapskuon (por postenigi la vageman buklon, kiu ĉiam malgraŭ ĉio volas fali antaŭ la okuloj); kaj dum ŝi aŭskultas—aŭ ŝajnas aŭskulti—la tuta ĉirkaŭaĵo fariĝis plene posedata de tiuj strangaj sonĝvivaĵoj.'}"
1088,"{'de': 'Das lange Gras zu ihren Füßen rauschte, da das weiße Kaninchen vorbeihuschte – die erschrockene Maus plätscherte durch den nahen Teich - sie konnte das Klappern der Teetassen hören, wo der Faselhase und seine Freunde ihre immerwährende Mahlzeit hielten, und die gellende Stimme der Königin, die ihre unglücklichen Gäste zur Hinrichtung abschickte – wieder nieste das Ferkel-Kind auf dem Schoße der Herzogin, während Pfannen und Schüsseln rund herum in Scherben brachen - wieder erfüllten der Schrei des Greifen, das Quieken von dem Tafelstein der Eidechse und das Stöhnen des unterdrückten Meerschweinchens die Luft und vermischten sich mit dem Schluchzen der unglücklichen falschen Schildkröte in der Entfernung.', 'eo': 'Jen la longa herbaĵo murmuris ĉe ŝiaj piedoj ĉar la Blanka Kuniklo preterpasas—jen la timigita Muso plaŭde naĝas tra la tutapuda al ŝi akvo—Jen ŝi ekaŭdis la tintadon de la tetasoj, dum la Martleporo kun siaj kunuloj partoprenas la neniam finiĝantan manĝadon, kaj la altvoĉajn kriojn de la Damo ordonanta la malfeliĉajn gastojn for, for al la ekzekutisto! Ankaŭ, jen la porkinfano ternadas sur la dukinaj genuoj, dum frakasiĝas ĉirkaŭe la teleroj kaj pladoj.'}"
1089,"{'de': 'So saß sie da, mit geschlossenen Augen, und glaubte fast, sie sei im Wunderlande, obgleich sie ja wußte, daß sobald sie die Au- gen öffnete, Alles wieder zur alltäglichen Wirklichkeit werden würde, das Gras würde dann nur im Winde rauschen, der Teich mit seinem Rieseln das Wogen des Rohres begleiten; das Klappern der Teetassen würde sich in klingende Heerdenglocken verwandeln und die gellende Stimme der Königin in die Rufe des Hirtenknaben – und das Niesen des Kindes, das Geschrei des Greifen und all die andern außerordentlichen Töne würden sich (das wußte sie) in das verworrene Getöse des geschäftigen Gutshofes verwandeln – während sie statt des schwermütigen Schluchzens der falschen Schildkröte in der das wohlbekannte Brüllen des Rindviehes hören würde.', 'eo': 'Tre longe ŝi sidadis, kun okuloj fermitaj, kaj preskaŭ kredis ke ŝi mem vagas en tiu stranga Mirlando, kvankam ŝi bone konsciis ke, se nur ŝi malfermos la okulojn, la fantazioj malaperos, kaj ĉio refariĝos ordinara. Se ŝi malfermos la okulojn, jam ne murmurigos la herbon Blanka Kuniklo, sed nur la vento; la akvoplaŭdojn kaŭzos ne la Muso, sed nur ŝanceliĝantaj kanoj; la tintadantaj tetasoj refariĝos ŝafsonoriloj; tuj mortos la altvoĉaj krioj de la furioza Damo, renaskiĝante kiel krioj de la ŝafpaŝtisto; la infana ternado kaj ĉiuj aliaj strangaj bruoj fariĝos—nur konfuzita bruaro de la farmkorto; kaj, anstataŭ la profundaj ĝemoj de la Falsa Kelonio, ŝi aŭdos de malproksime la blekadon de la bovinoj.'}"
1090,"{'de': 'Endlich malte sie sich aus, wie ihre kleine Schwester Alice in späterer Zeit selbst erwachsen sein werde; und wie sie durch alle reiferen Jahre hindurch das einfache liebevolle Herz ihrer Kindheit bewahren, und wie sie andere kleine Kinder um sich versammeln und deren Blicke neugierig und gespannt machen werde mit manch einer wunderbaren Erzählung, vielleicht sogar mit dem Traume vom Wunderlande aus alten Zeiten; und wie sie alle ihren kleinen Sorgen nachfühlen, sich über alle ihren kleinen Freuden mitfreuen werde in der Erinnerung an ihr eigenes Kindesleben und die glücklichen Sommertage.', 'eo': 'Fine, ŝi imagis al si kiel ĉi tiu sama fratineto en la venontaj jaroj estos mem plenaĝa virino; kiel ŝi kredeble gardos, dum la maturaj jaroj, la simplan kaj ameman koron kiu karakterizas la nunan infanecon; kiel ŝi kredeble kolektos ĉirkaŭ si aliajn infanojn, kaj al ili briligos la okulojn per multe da strangaj rakontoj, eble eĉ per tiu ĉi stranga Sonĝo; kiel ŝi kredeble simpatie partoprenos ĉiujn iliajn simplajn ĝojojn kaj malĝojojn, rememorante siajn infanjarojn kaj la belajn somertagojn.'}"
1091,"{'de': 'Source: http://www.zeno.org/', 'eo': 'Translation: Edwin Grobe'}"
1092,"{'de': 'Der Untergang des Hauses Usher', 'eo': 'LA FALO DE UŜERO-DOMO'}"
1093,"{'de': 'Edgar Allan Poe', 'eo': 'Edgar Allan Poe'}"
1094,"{'de': ""Son coeur est un luth suspendu; Sitôt qu'on le touche il résonne."", 'eo': 'Son cœur est un luth suspendu; Sitôt qu’on le touche il résonne.'}"
1095,"{'de': 'De Beranger', 'eo': 'De Béranger'}"
1096,"{'de': 'Ich war den ganzen Tag lang geritten, einen grauen und lautlosen melancholischen Herbsttag lang – durch eine eigentümlich öde und traurige Gegend, auf die erdrückend schwer die Wolken herabhingen. Da endlich, als die Schatten des Abends herniedersanken, sah ich das Stammschloß der Usher vor mir.', 'eo': 'Dum la tuta daŭro de teda, malhela, sensona tago en la aŭtuno de la jaro, kiam la nuboj pendis preme kaj malalte en la ĉielo, mi pasis sola, sur ĉevalo, tra malkutime morna kamparregiono; kaj finfine min trovis, dum estiĝis la vesperaj ombroj, ĉe vidpunkto pri la melankolia Uŝero-Domo.'}"
1097,"{'de': 'Ich weiß nicht, wie es kam – aber ich wurde gleich beim ersten Anblick dieser Mauern von einem unerträglich trüben Gefühl befallen.', 'eo': 'Mi malscias la kialon de tio—sed je la unua ekvido pri la konstruaĵo, sento de netolerebla malfeliĉo invadis mian spiriton.'}"
1098,"{'de': 'Ich sage unerträglich, denn dies Gefühl wurde durch keine der poetischen und darum erleichternden Empfindungen gelindert, mit denen die Seele gewöhnlich selbst die finstersten Bilder des Trostlosen oder Schaurigen aufnimmt.', 'eo': 'Mi diras ""netolerebla"" ĉar trankviligis tiun senton nenia duonplezuriga (ĉar poezia) sensaco kiun kutime registras la menso alfronte al la plej severaj naturaj bildoj pri sovaĝeco aŭ teruro.'}"
1099,"{'de': 'Ich betrachtete das Bild vor mir – das einsame Gebäude in seiner einförmigen Umgebung, die kahlen Mauern, die toten, wie leere Augenhöhlen starrenden Fenster, die paar Büschel dürrer Binsen, die weißschimmernden Stümpfe abgestorbener Bäume – mit einer Niedergeschlagenheit, die ich mit keinem anderen Gefühl besser vergleichen kann als mit dem trostlosen Erwachen eines Opiumessers aus seinem Rausche, dem bitteren Zurücksinnen in graue Alltagswirklichkeit, wenn der verklärende Schleier unerbittlich zerreißt.', 'eo': 'Mi rigardis la scenon antaŭ mi—la nuran domon kaj la simplajn pejzaĝtrajtojn de la bieno—la mornajn murojn—la malplenajn okulaspektajn fenestrojn—kelkajn fetorajn kareksojn—kaj kelkajn blankajn trunkojn de putrintaj arboj—kun nepra depremo de animo kiun mi scipovas kompari kun nenia surtera sensaco pli taŭge ol kun la postrevo de opiofestinto—la amara replonĝo en ĉiutagan vivadon—la malbelega forfalo de la vualo.'}"
1100,"{'de': 'Es war ein frostiges Erstarren, ein Erliegen aller Lebenskraft – kurz, eine hilflose Traurigkeit der Gedanken, die kein noch so gewaltsames Anstacheln der Einbildungskraft aufreizen konnte zu Erhabenheit, zu Größe.', 'eo': 'Ekestis glaciiĝo, sinkado, malsaniĝo de la koro—senkompensa morneco de pensado kiun sukcesis survojigi ĝis sublimeco nenia premego de la imagpovo.'}"
1101,"{'de': 'Was mochte es sein – dachte ich, langsamer reitend –, ja, was mochte es sein, daß der Anblick des Hauses Usher mich so erschreckend überwältigte?', 'eo': 'Kio—mi paŭzis por primediti la temon—kio min tiom maltrankviligis dum mi rigardis Uŝero-Domon?'}"
1102,"{'de': 'Es war mir ein Rätsel; aber ich konnte mich der grauen Wahngespenster nicht erwehren; ich mußte mich mit der wenig befriedigenden Erklärung begnügen, daß es tatsächlich in der Natur ganz einfache Dinge gibt, die durch die Umstände, in denen sie uns erscheinen, geradezu niederdrückend auf uns wirken können, daß es aber nicht in unsere Macht gegeben ist, eine Definition dieser Gewalt zu finden.', 'eo': 'Estis mistero nepre nesolvebla; cetere mi malsukcesis barakti kun la ombraj fantazioj kiuj min kunpremis dum mi meditadis. Mi devis min turni al la maltaŭga konkludo ke, dum sendube ja ekzistas kombinoj de tre simplaj naturaj objektoj havantaj la povon nin tiel afekcii, tamen la analizo de tiu povo nombriĝas inter konsideradoj preterpasantaj nian komprenon.'}"
1103,"{'de': 'Es wäre möglich, überlegte ich, daß eine etwas andere Anordnung der einzelnen Bestandteile dieses Landschaftsbildes genügen würde, um die düstere Stimmung des Ganzen abzuschwächen, ja vielleicht sogar vollständig aufzuheben. Von diesem Gedanken getrieben, lenkte ich mein Pferd an den steilen Abhang eines schwarzen sumpfigen Teiches, der von keinem Hauch bewegt neben dem Schlosse lag, und spähte ins Wasser – doch ein Schauder, stärker als zuvor, schüttelte mich beim Anblick der auf den Kopf gestellten und verzerrten Bilder der grauen Binsen, der gespenstischen Baumstümpfe und der toten, wie leere Augenhöhlen starrenden Fenster.', 'eo': 'Eblas, mi pensis, ke simpla malsama aranĝo de la trajtoj de la sceno, de la detaloj de la bildo, sufiĉos por aliigi aŭ eĉ entute nuligi ties kapablon fari malfeliĉan efekton; kaj, responde al tiu hipotezo, mi bridrimenis mian ĉevalon ĉe la kruta bordo de nigra kaj nebularda lageto kuŝanta en senbrua heleco apud la loĝejo kaj subenrigardis—sed kun tremego eĉ pli ekscitanta ol antaŭe—la rearanĝitajn kaj inversigitajn bildojn pri la griza karekso kaj la makabraj arbotrunkoj kaj la okulsimilaj fenestroj.'}"
1104,"{'de': 'Nichtsdestoweniger beschloß ich, in diesem schwermutvollen Hause einen Aufenthalt von mehreren Wochen zu nehmen.', 'eo': 'Tamen en ĉi tiu domego de morneco mi nun celis gastadi dum kelkaj semajnoj.'}"
1105,"{'de': 'Sein Eigentümer, Roderick Usher, war einer meiner liebsten Jugendfreunde gewesen, doch seit unserer letzten Begegnung waren viele Jahre dahingegangen.', 'eo': 'Ĝia proprietanto, Roderiko Uŝero, estis unu el miaj plej intimaj amikoj dum nia knabeco; tamen multaj jaroj forpasis ekde nia lasta renkontiĝo.'}"
1106,"{'de': 'Da hatte mich jüngst bei meinem Aufenthalt in einem entlegenen Teil des Landes ein Brief erreicht – ein Brief von ihm –, dessen seltsam ungestümer Charakter keine andere als eine persönliche und mündliche Beantwortung zuließ.', 'eo': 'Letero, tamen, atingintis min en fora regiono de la lando—letero de li—kiu, pro sia senbride petema karaktero, invitis nur vivpersonan respondon.'}"
1107,"{'de': 'Das Schreiben zeugte entschieden von nervöser Aufregung.', 'eo': 'La manuskripto vidigis indicojn pri nervoza maltrankvilo.'}"
1108,"{'de': 'Der Verfasser sprach von einer heftigen körperlichen Erkrankung – von niederdrückender geistiger Zerrüttung – und von dem innigen Wunsch, mich, der ich sein bester und tatsächlich sein einziger persönlicher Freund sei, wiederzusehen; er hoffe, meine erheiternde Gesellschaft werde seinem Zustande etwas Erleichterung bringen.', 'eo': 'La leterinto priparolis seriozegan korpan malsanon—mensan malsanon kiu lin premas—kaj pri sincera deziro vidi min, kiel lian plej bonan, kaj efektive solan amikon, kun la celo, pere de la plezuro de mia kompanio, iom malpligrandigi lian malsanon.'}"
1109,"{'de': 'Die Art und Weise, in der dies und vieles andere gesagt war – die Herzensbedrängnis, die aus seinem Verlangen sprach –, das war es, das mir kein Zögern erlaubte, und ich gehorchte daher dieser höchst seltsamen Aufforderung unverzüglich.', 'eo': 'Estis la maniero en kiu diritis ĉio tio, kaj multe pli—estis la ŝajna koreco kiu akompanis la peton—kiu malpermesis min heziti; rezulte mi obeis tujege kion mi daŭre konsideris ege malkutima alvoko.'}"
1110,"{'de': 'Obgleich wir als Knaben geradezu vertraute Kameraden gewesen waren, wußte ich dennoch recht wenig über meinen Freund.', 'eo': 'Kvankam, kiel knaboj, ni estis eĉ intimaj kunirantoj, mi malmulte sciis tamen pri mia amiko.'}"
1111,"{'de': 'Seine Zurückhaltung war immer außerordentlich gewesen; sie war ihm ganz selbstverständlich erschienen.', 'eo': 'Lia distancemo estis ĉiam ekscesa kaj konstanta.'}"
1112,"{'de': 'Immerhin war mir bekannt, daß seine sehr alte Familie seit unvordenklichen Zeiten wegen einer eigentümlichen Reizbarkeit des Temperaments bekannt gewesen war, einer Reizbarkeit, die lange Jahre hindurch in vielen erhaben eigenartigen Kunstwerken sich aussprach; später betätigte sich dies feinfühlige Empfinden in mancher Handlung großmütiger, doch unauffälliger Mildtätigkeit und in der leidenschaftlichen Hingabe an das Studium der Musik – weniger also an ihre altbekannten leichtfaßlichen Schönheitsformen, als an die tiefverborgenen Probleme dieser Kunst.', 'eo': 'Mi konsciis tamen ke lia ege antikva familio estis fama, jam en forpasintaj epokoj, por aparta sensivo de temperamento sin montranta, dum longaj periodoj, en multaj verkoj de laŭdeginda arto kaj, pli lastatempe, en ripetitaj faroj de malavarega sed senfanfarona almozo, kaj cetere en pasia sindediĉo al la komplikaĵoj, eble eĉ pli ol al la tradiciaj kaj facile rekoneblaj belecoj, de la muzikaj sciencoj.'}"
1113,"{'de': 'Ich hatte auch die sehr bemerkenswerte Tatsache erfahren, daß der Stammbaum der Familie Usher, die jederzeit hochangesehen gewesen, zu keiner Zeit einen ausdauernden Nebenzweig hervorgebracht hatte, mit anderen Worten, daß die Abstammung der ganzen Familie in direkter Linie herzustellen war.', 'eo': 'Mi eksciis ankaŭ la ege rimarkindan fakton ke la tigo de la Uŝera gento, kvankam ĝuante longtempajn honorojn, neniam fondis daŭran branĉon; alivorte, ke la tuta familio sin limigis al rekta devenlinio kaj ĉiam, krom ege malgravaj kaj ege provizoraj varioj, ade sin limigas tiel.'}"
