id,translation
685,"{'de': 'Alice fing an sich sehr unbehaglich zu fühlen, sie hatte zwar noch keinen Streit mit der Königin gehabt, aber sie wußte, daß sie keinen Augenblick sicher davor war, »und was,« dachte sie, »würde dann aus mir werden? die Leute hier scheinen schrecklich gern zu köpfen; es ist das größte Wunder, daß überhaupt noch welche am Leben geblieben sind!«', 'eo': 'Estas vero, ke ĝis nun ŝi ne havis disputon kun la Damo, sed ŝi tre bone sciis ke tio facile povas okazi, ""kaj se mi ofendos ŝin,"" pensis ŝi, ""kio okazos al mi? Tie ĉi oni tiel ofte ordonas senkapigojn, ke mirinde estas ke eĉ unu individuo restas vivanta.""'}"
686,"{'de': 'Sie sah sich nach einem Ausgange um und überlegte, ob sie sich wohl ohne gesehen zu werden, fortschleichen könne, als sie eine merkwürdige Erscheinung in der Luft wahrnahm: sie schien ihr zuerst ganz rätselhaft, aber nachdem sie sie ein Paar Minuten beobachtet hatte, erkannte sie, daß es ein Grinsen war, und sagte bei sich: »Es ist die Grinse-Katze; jetzt werde ich Jemand haben, mit dem ich sprechen kann.«', 'eo': 'Unue ŝi ne povis imagi kio ĝi estas; sed observinte ĝin kelke da momentoj, ŝi konstatis ke ĝi estas grimaco. ""Do, la Ĉeŝŝa Kato venas,"" ŝi konkludis, ""nun mi havos kunparolanton.""'}"
687,"{'de': '»Wie geht es dir?« sagte die Katze, sobald Mund genug da war, um damit zu sprechen.', 'eo': '""Ĉu vi bone progresas en la ludo?"" diris la Kato, kiam aperis nur la buŝo kaj la cetera parolilaro.'}"
688,"{'de': 'Alice wartete, bis die Augen erschienen, und nickte ihr zu. »Es nützt nichts mit ihr zu reden,« dachte sie, »bis ihre Ohren gekommen sind, oder wenigstens eins.« Den nächsten Augenblick erschien der ganze Kopf; da setzte Alice ihren Flamingo nieder und fing ihren Bericht von dem Spiele an, sehr froh, daß sie Jemand zum Zuhören hatte.', 'eo': 'Tuj kiam aperis la okuloj, Alicio amike salutis. ""Sed ne utilas alparoli ĝin,"" pensis ŝi, ""ĝis la oreloj aperos, aŭ almenaŭ unu el ili.""'}"
689,"{'de': 'Die Katze schien zu glauben, daß jetzt genug von ihr sichtbar sei, und es erschien weiter nichts.', 'eo': 'Alicio demetis sian fenikopteron, kaj komencis doni plenan raporton pri la ludado, ĝojante, ke nun ŝi havas atentan aŭskultanton. La Kato ŝajne opiniis, ke jam estas videbla sufiĉe da lia korpo, kaj li aperigis nenion plu.'}"
690,"{'de': '»Ich glaube, sie spielen gar nicht gerecht,« fing Alice in etwas klagendem Tone an, »und sie zanken sich Alle so entsetzlich, daß man sein eigenes Wort nicht hören kann und dann haben sie gar keine Spielregeln, wenigstens wenn sie welche haben, so beobachtet sie Niemand und du hast keine Idee, wie es Einen verwirrt, daß alle Krocket-Sachen lebendig sind; zum Beispiel da ist der Bogen, durch den ich das nächste Mal spielen muß, und geht am andern Ende des Grasplatzes spazieren und ich hätte den Igel der Königin noch eben treffen können, nur daß er fortrannte, als er meinen kommen sah!«', 'eo': '""Laŭ mi, oni ludas tre maljuste,"" diris Alicio per iom plenda voĉo, ""kaj ĉiuj tiel laŭte malpacas, ke mi ne povas aŭdi mian propran voĉon; oni ne havas definitivajn regulojn, aŭ se ekzistas tiaj, oni ne atentas ilin. Ankaŭ vi ne povas imagi kiel konfuzige estas ke ĉiuj ludiloj—pilkoj, arkoj, k.t.p. estas vivaj.'}"
691,"{'de': '»Wie gefällt dir die Königin?« fragte die Katze leise.', 'eo': '""Tute ne,"" respondis Alicio. ""Ŝi ja estas tiel ekstreme—""'}"
692,"{'de': '»Ganz und gar nicht,« sagte Alice, »sie hat so sehr viel -« da bemerkte sie eben, daß die Königin dicht hinter ihr war und zuhörte, also setzte sie hinzu: »Aussicht zu gewinnen, daß es kaum der Mühe wert ist, das Spiel auszuspielen.«', 'eo': 'En tiu momento ŝi rimarkis ke la Damo staras malantaŭ ŝi kaj aŭskultas, do ŝi daŭrigis: ""—lerta kaj trafema, ke neniu alia havas eĉ la plej malgrandan venkŝancon.""'}"
693,"{'de': 'Die Königin lächelte und ging weiter.', 'eo': 'La Damo ridetis afable kaj preterpasis!'}"
694,"{'de': '»Mit wem redest du da ?« sagte der König, indem er an Alice herantrat und mit großer Neugierde den Katzenkopf ansah.', 'eo': '""Kiun ajn vi alparolas?"" diris la Reĝo, alvenante antaŭ Alicion, kaj rigardante el larĝe malfermitaj okuloj la Katkapon.'}"
695,"{'de': '»Es ist einer meiner Freunde ein Grinse-Kater,« sagte Alice; »erlauben Eure Majestät, daß ich ihn Ihnen vorstelle.«', 'eo': '""Unu mian amikon,"" Alicio ĝentile respondis. ""Permesu ke mi prezentu al vi—la Ĉeŝŝa Katon.""'}"
696,"{'de': '»Sein Aussehen gefällt mir gar nicht,« sagte der König; »er mag mir jedoch die Hand küssen, wenn er will.«', 'eo': '""Mi tute ne aprobas ĝian aspekton,"" diris la Reĝo, ""tamen se al ĝi plaĉos, mi permesos al ĝi kisi mian manon.""'}"
697,"{'de': '»O, lieber nicht!« versetzte der Kater.', 'eo': '""Tio ne plaĉas,"" diris la Kato.'}"
698,"{'de': '»Sei nicht so impertinent,« sagte der König, »und sieh mich nicht so an!« Er stellte sich hinter Alice, als er dies sagte.', 'eo': 'La Reĝo metis sian reĝan korpon por protekto malantaŭ Alicion. ""Vi ne insultu,"" diris li el tiu rifuĝejo, ""kaj—ne rigardu min.""'}"
699,"{'de': '»Der Kater sieht den König an, der König sieht den Kater an,« sagte Alice, »das habe ich irgendwo gelesen, ich weiß nur nicht mehr wo.«', 'eo': '""La Kato ja rajtas rigardi vin,""13 diris Alicio. ""Tion mi certe legis en iu libro kvankam mi ne povas rememori la titolon.""'}"
700,"{'de': '»Fort muß er,« sagte der König sehr entschieden, und rief der Königin zu, die gerade vorbeiging: »Meine Liebe! ich wollte, du ließest diesen Kater fortschaffen!«', 'eo': '""Tamen ĝi devas esti formovita,"" diris la Reĝo fortemfaze. Kaj alvokinte la Damon, kiu en tiu momento preterpasas, ""Mi tre volas,"" diris li, ""ke vi, karulino, formovigu tiun katon.""'}"
701,"{'de': 'Die Königin kannte nur eine Art, alle Schwierigkeiten, große und kleine, zu beseitigen. »Schlagt ihm den Kopf ab!« sagte sie, ohne sich einmal umzusehen.', 'eo': 'Por forigi ĉiujn malagrablaĵojn, ĉu gravaj, ĉu trivialaj, la Damo ja havis ĉiam la saman rimedon. ""Senkapigu ĝin,"" ŝi diris, eĉ ne turnante la kapon por rigardi.'}"
702,"{'de': '»Ich werde den Henker selbst holen,« sagte der König eifrig und eilte fort.', 'eo': '""Do, mi venigos mem la ekzekutiston,"" diris la Reĝo, kaj tiucele li tuj rapidis for.'}"
703,"{'de': 'Alice dachte, sie wollte lieber zurück gehen und sehen, wie es mit dem Spiele stehe, da sie in der Entfernung die Stimme der Königin hörte, die vor Wut außer sich war.', 'eo': 'En tiu momento Alicio ekaŭdis la voĉon de la Damo, kiu malproksime kriegas furioze. Jam tri ludantojn la Damo mortkondamnis nur pro neĉeesto en siaj vicoj.'}"
704,"{'de': 'Sie hatte sie schon drei Spieler zum Tode verurteilen hören, weil sie ihre Reihe verfehlt hatten, und der Stand der Dinge behagte ihr gar nicht, da das Spiel in solcher Verwirrung war, daß sie nie wußte, ob sie an der Reihe sei oder nicht. Sie ging also, sich nach ihrem Igel umzusehen.', 'eo': 'La ludado fariĝis tiel miksita, ke Alicio neniel povis certiĝi kiam ŝi havas la vicon. Do, ŝi prudente decidiĝis reiri por eltrovi, se eble, la nunan staton de la ludo, kaj serĉi sian erinacon.'}"
705,"{'de': 'Der Igel war im Kampfe mit einem andern Igel, was Alice eine vortreffliche Gelegenheit schien, einen mit dem andern zu treffen; die einzige Schwierigkeit war, daß ihr Flamingo nach dem andern Ende des Gartens gegangen war, wo Alice eben noch sehen konnte, wie er höchst ungeschickt versuchte, auf einen Baum zu fliegen.', 'eo': 'Sian erinacon ŝi trovis batalanta kontraŭ alia erinaco. Jen tre oportuna momento por martelumi ilin unu per alia, sed unu cirkonstanco malhelpis; ŝia fenikoptero forestis en alia parto de la ĝardeno, kie (laŭ la informo de ŝiaj okuloj) ĝi klopodadas per tre mallertaj flugpenoj levi sin sur arbon.'}"
706,"{'de': 'Als sie den Flamingo gefangen und zurückgebracht hatte, war der Kampf vorüber und die beiden Igel nirgends zu sehen. »Aber es kommt nicht drauf an,« dachte Alice, »da alle Bogen auf dieser Seite des Grasplatzes fortgegangen sind.« Sie steckte also ihren Flamingo unter den Arm, damit er nicht wieder fortliefe, und ging zurück, um mit ihrem Freunde weiter zu schwatzen.', 'eo': '""Tio tamen ne estas tre grava,"" pensis Alicio, ""ĉar ankaŭ malaperis ĉiuj arkoj."" Do, pakinte la fenikopteron sub la brako, por ke ĝi ne ree foriĝu, ŝi reiris al la Kato, en la espero iom pli babiladi kun ĝi.'}"
707,"{'de': 'Als sie zum Cheshire-Kater zurück kam, war sie sehr erstaunt, einen großen Auflauf um ihn versammelt zu sehen: es fand ein großer Wortwechsel statt zwischen dem Henker, dem Könige und der Königin, welche alle drei zugleich sprachen, während die Übrigen ganz still waren und sehr ängstlich aussahen.', 'eo': 'Ĉirkaŭ la Kato la gastoj grandamase kolektiĝis, kaj forta disputado okazas inter la ekzekutisto kaj la gereĝoj. Ĉiuj ĉi parolas samtempe; la ceteraj silente ĉirkaŭstaras, kaj ekscitite aŭskultas.'}"
708,"{'de': 'Sobald Alice erschien, wurde sie von allen dreien aufgefordert, den streitigen Punkt zu entscheiden, und sie wiederholten ihr ihre Beweisgründe, obgleich, da alle zugleich sprachen, man kaum verstehen konnte, was jeder Einzelne sagte.', 'eo': 'Tuj kiam Alicio aperis, ĉiuj disputantoj alvokis ŝin por decidi la aferon. Sed ĉar ĉiuj parolis samtempe, estis por ŝi tre malfacile bone aŭdi la diratajn vortojn.'}"
709,"{'de': 'Der Henker behauptete, daß man keinen Kopf abschneiden könne, wo kein Körper sei, von dem man ihn abschneiden könne; daß er so etwas noch nie getan habe, und jetzt über die Jahre hinaus sei, wo man etwas Neues lerne.', 'eo': 'La ekzekutisto argumentis ke oni ne povas detranĉi kapon, se ne ekzistas korpo de kiu oni povas apartigi ĝin. Neniam en la tuta vivo li devis trakti tian aferon, kaj li jam estas tro aĝa por komenci tute novan metion.'}"
710,"{'de': 'Der König behauptete, daß Alles, was einen Kopf habe, geköpft werden könne, und daß man nicht so viel Unsinn schwatzen solle.', 'eo': 'La Reĝo argumentis: ""Oni ja povas senkapigi ĉion, kio nur havas kapon; oni do ne parolu sensencaĵon.""'}"
711,"{'de': 'Die Königin behauptete, daß wenn nicht in weniger als keiner Frist etwas geschehe, sie die ganze Gesellschaft würde köpfen lassen.', 'eo': 'Kaj jen fine la dama argumento: ""Se iel la afero ne estos dece konsentita jam nun, mi ĉiujn senescepte ekzekutigos.""'}"
712,"{'de': '(Diese letztere Bemerkung hatte der Versammlung ein so ernstes und ängstliches Aussehen gegeben.)', 'eo': '(Tio ĉi ja iom klarigas la kaŭzon de la jam aludita eksciteco de la gastoj!)'}"
713,"{'de': 'Alice wußte nichts Besseres zu sagen als: »Er gehört der Herzogin, es wäre am besten sie zu fragen.«', 'eo': 'Alicio ne povis elpensi ion pli dirindan ol: ""Ĝi apartenas al la Dukino; mi konsilas ke vi turnu vin al ŝi.""'}"
714,"{'de': '»Sie ist im Gefängnis,« sagte die Königin zum Henker, »hole sie her.« Und der Henker lief davon wie ein Pfeil.', 'eo': '""Ŝi estas en la kondamnitejo, vi venigu ŝin,"" diris la Damo. La ekzekutisto tuj ekrapidis for, kiel sago el pafarko.'}"
715,"{'de': 'Da wurde der Kopf des Katers undeutlicher und undeutlicher; und gerade in dem Augenblick, als der Henker mit der Herzogin zurück kam, verschwand er gänzlich; der König und der Henker liefen ganz wild umher, ihn zu suchen, während die übrige Gesellschaft zum Spiele zurückging.', 'eo': 'Tuj post lia foriro la Katkapo komencis esti kvazaŭ nebula; kiam li revenis kun la Dukino, ĝi jam tute malaperis. Sekve la Reĝo kaj la ekzekutisto ĉirkaŭkuris kiel frenezuloj serĉante ĝin, kaj la aliaj iris returne al la ludejo.'}"
716,"{'de': 'Neuntes Kapitel – Die Geschichte der falschen Schildkröte', 'eo': 'ĈAPITRO IX La Viv-historio de la Falsa Kelonio14'}"
717,"{'de': '»Du kannst dir gar nicht denken, wie froh ich bin, dich wieder zu sehen, du liebes altes Herz!« sagte die Herzogin, indem sie Alice liebevoll umfaßte, und beide zusammen fortspazierten.', 'eo': '""Vi ne povas imagi,"" diris la Dukino, ""kiel ĝojige estas por mi revidi vin, mia kara."" Dirante tion, ŝi ligis sin al Alicio per la brako en tre bonkamarada maniero, kaj ili ekmarŝis kune.'}"
718,"{'de': 'Alice war sehr froh, sie bei so guter Laune zu finden, und dachte bei sich, es wäre vielleicht nur der Pfeffer, der sie so böse gemacht habe, als sie sich zuerst in der Küche trafen. »Wenn ich Herzogin bin,« sagte sie für sich (doch nicht in sehr hoffnungsvollem Tone), »will ich gar keinen Pfeffer in meiner Küche dulden.', 'eo': 'Tre plaĉis al Alicio trovi, ke la Dukino estas nun bonhumora, kaj ŝi interne pensis ke antaŭe, kiam ili renkontiĝis en la kuirejo, eble igis ŝin malagrabla nur la pipro. ""Kiam mi estos Dukino,"" pensis ŝi, ""da pipro mi havos en mia kuirejo ĝuste neniom.'}"
719,"{'de': 'Suppe schmeckt sehr gut ohne Am Ende ist es immer Pfeffer, der die Leute heftig macht,« sprach sie weiter, sehr glücklich, eine neue Regel erfunden zu haben, »und Essig, der sie sauertöpfisch macht und Kamillentee, der sie bitter macht und Gerstenzucker und dergleichen, was Kinder zuckersüß macht.', 'eo': 'Eble pipro estas ĉiam la kaŭzo kiu igas la homojn koleraj."" Kaj ŝi daŭrigis tre fiere, kvazaŭ konsciante ke nun ŝi eldonas novan principon, tre gravan por la homoj:—""Nur vinagro acidigas ilin, nur kamomilo maldolĉigas, kaj—(lasta kaj plej grava principo)—nur sukeraĵoj dolĉigas la infanojn.'}"
720,"{'de': 'Ich wünschte nur, die großen Leute wüßten das, dann würden sie nicht so sparsam damit sein', 'eo': 'Se nur la plenaĝuloj tion scius, ili estus ja malpli ŝparemaj—""'}"
721,"{'de': '-« Sie hatte unterdessen die Herzogin ganz vergessen und schrak förmlich zusammen, als sie deren Stimme dicht an ihrem Ohre hörte. »Du denkst an etwas, meine Liebe, und vergißt darüber zu sprechen.', 'eo': 'Ŝi jam tute forgesis la Dukinon, kaj eksaltis surprize, aŭdante ŝian voĉon diranta:— ""Vi ion pripensas, mia kara, kaj pro tio forgesas paroli.'}"
722,"{'de': 'Ich kann dir diesen Augenblick nicht sagen, was die Moral davon ist, aber es wird mir gleich einfallen.«', 'eo': 'Mi ne povas en la nuna momento citi la moralon de tio, sed kredeble mi rememoros ĝin poste.""'}"
723,"{'de': '»Vielleicht hat es keine,« hatte Alice den Muth zu sagen.', 'eo': '""Eble ĝi ne havas moralon,"" Alicio kuraĝis diri.'}"
724,"{'de': '»Still, still, Kind!« sagte die Herzogin. »Alles hat seine Moral, wenn man sie nur finden kann.« Dabei drängte sie sich dichter an Alice heran.', 'eo': 'Vi bubino,"" diris la Dukino, ""ĉio ja havas moralon, se nur oni povas trovi ĝin."" Dum ŝi parolis, la Dukino premis sin pli forte kontraŭ Alicio.'}"
725,"{'de': ""Alice mochte es durchaus nicht gern, daß sie ihr so nahe kam: erstens, weil die Herzogin sehr häßlich war, und zweitens, weil sie gerade groß genug war, um ihr Kinn auf Alice's Schultern zu stützen, und es war ein unangenehm spitzes Kinn."", 'eo': 'Alicio ne tre ŝatis tiun ĉi troproksimiĝon; unue, ĉar la Dukino estas (de proksime) tre malbela; kaj due, ĉar ŝi havas ĝuste la taŭgan altecon por apogi sian akran mentonon sur la ŝultro de Alicio.'}"
726,"{'de': 'Da sie aber nicht gern unhöflich sein wollte, so ertrug sie es, so gut sie konnte.', 'eo': 'Tamen, ĉar ŝi ne volis esti malagrabla, ŝi laŭeble toleris ĉion.'}"
727,"{'de': '»Das Spiel ist jetzt besser im Gange,« sagte sie, um die Unterhaltung fortzuführen.', 'eo': '""La kroketludo ŝajnas nun progresi pli bone,"" diris ŝi.'}"
728,"{'de': '»So ist es,« sagte die Herzogin, »und die Moral davon ist Mit Liebe und Gesange hält man die Welt im Gange !«', 'eo': '""Mi konsentas,"" diris la Dukino, ""kaj de tio la moralo estas: \'Ho, nur la amo, nur la amo igas la mondon rondiri.\'""'}"
729,"{'de': '»Wer sagte denn,« flüsterte Alice, »es geschehe dadurch, daß Jeder vor seiner Türe fege.«', 'eo': '""Ĉu ne iu,"" preskaŭ sarkasme demandis Alicio, ""antaŭe diris en la kuirejo ke la kondiĉo de tiu rondiro estas ke ĉiu atentu nur sian aferon?""'}"
730,"{'de': ""»Ah, sehr gut, das bedeutet ungefähr dasselbe,« sagte die Herzogin, und indem sie ihr spitzes kleines Kinn in Alice's Schulter einbohrte, fügte sie hinzu »und die Moral davon ist So viel Köpfe, so viel Sinne.«"", 'eo': '""Nu, la signifo ja estas preskaŭ sama,"" diris la Dukino, ŝultrumante Alicion per sia mentonego, ""kaj de tio la moralo estas: \'Se vi prizorgas la sencon, la sonoj prizorgos sin mem.\'""'}"
731,"{'de': '»Wie gern sie die Moral von Allem findet!« dachte Alice bei sich.', 'eo': '""Ĉe ĉiu afero ŝi ja volas trovi moralon,"" pensis Alicio.'}"
732,"{'de': '»Du wunderst dich wahrscheinlich, warum ich meinen Arm nicht um deinen Hals lege,« sagte die Herzogin nach einer Pause; »die Wahrheit zu gestehen, ich traue der Laune deines Flamingos nicht ganz.', 'eo': '""Vi eble miras, kial mi ne ĉirkaŭprenas al vi la talion,"" diris iom poste la Dukino. ""La kaŭzo estas, ke mi dubas pri la bonhumoro de via fenikoptero.'}"
733,"{'de': 'Soll ich es versuchen?«', 'eo': 'Ĉu mi faros la provon?""'}"
734,"{'de': '»Er könnte beißen,« erwiderte Alice weislich, da sie sich keineswegs danach sehnte, das Experiment zu versuchen.', 'eo': '""Ne, li eble mordus vin."" Alicio diris tion pro singardaj motivoj; ŝi tute ne deziris la provon.'}"
735,"{'de': '»Sehr wahr,« sagte die Herzogin, »Flamingos und Senf beißen beide.', 'eo': '""Estas vero,"" respondis la Dukino.'}"
736,"{'de': 'Und die Moral davon ist: Gleich und Gleich gesellt sich gern.«', 'eo': '""Fenikopteroj kaj mustardo ambaŭ mordas; kaj jen la moralo: \'Samspecaj birdoj flugas kune.\'""'}"
737,"{'de': '»Aber der Flamingo ist ja ein Vogel und Senf ist kein Vogel,« wandte Alice ein.', 'eo': '""Tamen mustardo ne estas birdo,"" Alicio kritikis.'}"
738,"{'de': '»Ganz recht, wie immer,« sagte die Herzogin, »wie deutlich du Alles ausdrücken kannst.«', 'eo': '""Vi estas prava, kiel ĉiam,"" afable konsentis la Dukino. ""Mi tre admiras vian spritecon; per viaj paroloj vi ja igas ĉion klara.""'}"
739,"{'de': '»Es ist, glaube ich, ein Mineral,« sagte Alice.', 'eo': '""Mi kredas ke mustardo estas mineralo, ĉu ne?"" diris Alicio.'}"
740,"{'de': '»Versteht sich,« sagte die Herzogin, die Allem, was Alice sagte, beizustimmen schien, »in dem großen Senf-Bergwerk hier in der Gegend sind ganz vorzüglich gute Minen.', 'eo': '""Jes, kompreneble,"" diris la Dukino. (Ŝi ŝajne estis preta konsenti al ĉio ajn de Alicio dirota.)'}"
741,"{'de': 'Und die Moral davon ist, daß wir gute Miene zum bösen Spiel machen müssen.«', 'eo': '""Ne malproksime de tie ĉi mi mem havas grandan mustardminejon, kaj la moralo: \'Da tio kion mi jam havas en min\', vi ne tro enigu en min.\'""'}"
742,"{'de': '»O, ich weiß!« rief Alice aus, die die letzte Bemerkung ganz überhört hatte, »es ist eine Pflanze.', 'eo': 'Alicio dume profundiĝis en pensojn, kaj pro tio ne atentis—eĉ ne aŭdis—pri la dukina minejo.'}"
743,"{'de': 'Es sieht nicht so aus, aber es ist eine.«', 'eo': 'Post unu minuto ŝi ekkriis: ""Ho jam fine mi bone memoras: Mustardo estas legomo, kvankam ĝi ne havas la aspekton esti tia.""'}"
744,"{'de': '»Ich stimme dir vollkommen bei,« sagte die Herzogin, »und die Moral davon ist: Sei was du zu scheinen wünschest! oder einfacher ausgedrückt: Bilde dir nie ein verschieden von dem zu sein was Anderen erscheint daß was du warest oder gewesen sein möchtest nicht verschieden von dem war daß was du gewesen warest ihnen erschienen wäre als wäre es verschieden.«', 'eo': '""Mi tute konsentas,"" denove diris la konsentema Dukino, ""kaj jen la moralo:—\'Vi ĉiam estu laŭ la aspekto\'—aŭ se vi volas ke mi esprimu ĝin pli klare:—\'Vi neniam imagu al vi ke vi ne estas aliaspekta ol tio, kio al aliaj ŝajnus ke kio vi aŭ estis aŭ aspektus esti, ne estas aliaspekta ol kio vi antaŭe estis, estus ŝajninta al ili esti aliaspekta.\'""'}"
745,"{'de': '»Ich glaube, ich würde das besser verstehen,« sagte Alice sehr höflich, »wenn ich es aufgeschrieben hätte; ich kann nicht ganz folgen, wenn Sie es sagen.«', 'eo': '""Mi kredas ke tion mi povus pli bone kompreni,"" diris Alicio tre ĝentile, ""se mi havus ĝin skribitan antaŭ la okuloj; sed, bedaŭrinde mi ne tute sukcesis kapti la signifon dum vi parolis.""'}"
746,"{'de': '»Das ist noch gar nichts dagegen, was ich sagen könnte, wenn ich wollte,« antwortete die Herzogin in selbstzufriedenem Tone.', 'eo': '""Tio ja,"" diris la Dukino per tre memkontenta voĉo, ""estas nur nulaĵo kompare kun la diroj kiujn mi povus eldiri.""'}"
747,"{'de': '»Bitte, bemühen Sie sich nicht, es noch länger zu sagen!« sagte Alice.', 'eo': '""Tamen ne ĝenu vin, mi petas,"" Alicio rapide respondis, ""donante plilongan klarigon; mi timas ke vi tro lacigus vin per tia laboro.""'}"
748,"{'de': '»O, sprich nicht von Mühe!« sagte die Herzogin, »ich will dir Alles, was ich bis jetzt gesagt habe, schenken.«', 'eo': '""Ho, ne parolu pri la laboro, mi petas,"" diris la Dukino, ""mi ja oferas al vi donace ĉion, kion mi diris ĝis nun.""'}"
749,"{'de': '»Eine wohlfeile Art Geschenke!« dachte Alice, »ich bin froh, daß man nicht solche Geburtstagsgeschenke macht!« Aber sie getraute sich nicht, es laut zu sagen.', 'eo': '""Jen donaco efektive nulkosta!"" pensis Alicio. ""Mi tute ne ŝatus, ke la naskotagaj donacoj estu tiaspecaj.""'}"
750,"{'de': '»Wieder in Gedanken?« fragte die Herzogin und grub ihr spitzes kleines Kinn tiefer ein.', 'eo': '""Ĉu ree vi pensas?"" diris la Dukino, kaj Alicio denove sentis sur la ŝultro speciale fortan ekpremon de la dukina mentono.'}"
751,"{'de': '»Ich habe das Recht, in Gedanken zu sein, wenn ich will,« sagte Alice gereizt, denn die Unterhaltung fing an, ihr langweilig zu werden.', 'eo': '""Mi ja rajtas pensi,"" iom akre respondis Alicio, ĉar ŝi komencis senti sin ĝenata.'}"
752,"{'de': '»Gerade so viel Recht,« sagte die Herzogin, »wie Ferkel zum Fliegen, und die M-«', 'eo': '""Vi rajtas certe,"" konsentis la Dukino, ""sed ne pli ol porkoj rajtas flugi; kaj la M—""'}"
753,"{'de': ""Aber, zu Alice's großem Erstaunen stockte hier die Stimme der Herzogin, und zwar mitten in ihrem Lieblingsworte »Moral«, und der Arm, der in dem ihrigen ruhte, fing an zu zittern."", 'eo': 'Sed en tiu momento Alicio forte surpriziĝis, ĉar eĉ en la komenco de tiu tre ŝatata vorto, la dukina voĉo ekvelkis, kaj la dukina brako, ligita kun la ŝia, forte tremis.'}"
754,"{'de': 'Alice sah auf, und da stand die Königin vor ihnen, mit über der Brust gekreuzten Armen, schwarzblickend wie ein Gewitter.', 'eo': 'Jen, rekte kontraŭ ili, vizaĝo kontraŭ vizaĝo, staris la Kera Damo, kun la brakoj falditaj. Ŝi sulkigas fulmotondre la brovojn.'}"
755,"{'de': '»Ein schöner Tag, Majestät!« fing die Herzogin mit leiser schwacher Stimme an.', 'eo': '""Estas bela tago, via Dama Moŝtino,"" la Dukino komencis per tre humila kaj malforta voĉo.'}"
756,"{'de': '»Ich will Sie schön gewarnt haben,« schrie die Königin und stampfte dabei mit dem Fuße: »Fort augenblicklich, entweder mit Ihnen oder mit Ihrem Kopfe! Wählen Sie!«', 'eo': '""Jam nun mi admonas vin,"" la Damo pasie interrompis ŝin, piedfrapante la grundon, ""aŭ vi aŭ via kapo jam nun devas esti for, vi elektu!""'}"
757,"{'de': 'Die Herzogin wählte und verschwand eilig.', 'eo': 'La Dukino elektis, kaj—malaperis!'}"
758,"{'de': '»Wir wollen weiter spielen,« sagte die Königin zu Alice, und diese, viel zu erschrocken, ein Wort zu erwidern, folgte ihr langsam nach dem Krocket-Felde.', 'eo': '""Ni daŭrigu la ludadon,"" la Damo diris al Alicio; kaj Alicio, tro timigite por eligi eĉ unu vorton, per malvolantaj paŝoj sekvis ŝin al la ludejo.'}"
759,"{'de': 'Die übrigen Gäste hatten die Abwesenheit der Königin benutzt, um im Schatten auszuruhen; sobald sie sie jedoch kommen sahen, eilten sie augenblicklich zum Spiele zurück, indem die Königin einfach bemerkte, daß eine Minute Verzug ihnen das Leben kosten würde.', 'eo': 'Sed ekvidinte la Damon, ili tuj levis sin kaj enue ekludis. Por instigi ilin la Damo anoncis ke eĉ unumomenta prokrasto kostos al la prokrastanto—la vivon.'}"
760,"{'de': 'Die ganze Zeit, wo sie spielten, hörte die Königin nicht auf, mit den andern Spielern zu zanken und zu schreien: »Schlagt ihm den Kopf ab!« oder: »Schlagt ihr den Kopf ab!« Diejenigen, welche sie verurteilt hatte, wurden von den Soldaten in Verwahrsam geführt, die natürlich dann aufhören mußten, die Bogen zu bilden, so daß nach ungefähr einer halben Stunde keine Bogen mehr übrig waren, und alle Spieler, außer dem Könige, der Königin und Alice, in Verwahrsam und zum Tode verurteilt waren.', 'eo': 'Dum la tuta ludtempo, tra la tuta ludkampo, la Damo ne ĉesis malpaci kun la aliaj ludantoj kaj ĉiumomente kriegis ""Senkapigu lin,"" aŭ ""Senkapigu ŝin."" La soldatoj devis gardi la ĉiuminute mortkondamnatojn; por plenumi tiun devon, estis necese ke ili forlasu la luddevon, t.e. la devon esti arkoj; kaj konsekvence restis post duonhoro eĉ ne unu arko; ĉiuj partoprenintoj (krom la Reĝo, la Damo, kaj Alicio) estis jam mortkondamnitaj kaj soldate gardataj.'}"
761,"{'de': 'Da hörte die Königin, ganz außer Atem, auf und sagte zu Alice: »Hast du die Falsche Schildkröte schon gesehen?«', 'eo': 'La Damo—pro manko da senkapigebla materialo—ĉesis labori, kaj per spireganta voĉo demandis al Alicio: ""Ĉu vi jam vidis la Falsan Kelonion?""'}"
762,"{'de': '»Nein,« sagte Alice. »Ich weiß nicht einmal, was eine Falsche Schildkröte ist.«', 'eo': '""Ne,"" respondis ŝi, ""eĉ mi ne scias kio estas Falsa Kelonio.""'}"
